### ISSUE TITLE
Can't find devices

### ISSUE THREAD

**Issue by jemarr** [FezVrasta/node-red-matter#3]
Hi.

I used Node-Red for years with Virtual-Smart-Home plugin, but now I would like to start with Matter.

I've installed your node and imported the example (I just keep one light for simplicity).

Deploying the flow is ok, but Alexa nor Apple Home can't detect the light device.

I tested Alexa app in ios and android without success.

Apple Home says that the device needs a 'Central de accesorios' in spanish to complete configuration, seems to need a bridge or Hub.

My system is a RaspberryPi with Dietpi linux and it is connected via ethernet to my internet router.

Thanks for your nice work.

**Comment by FezVrasta** [comment]
Hi, could you please provide your flow backup and the Node-RED debug logs from when you start the flow to when the pairing fails through Apple Home?

**Comment by jemarr** [comment]
[Matter flow.zip](https://github.com/FezVrasta/node-red-matter/files/12550535/Matter.flow.zip)

This is the flow,

**Comment by FezVrasta** [comment]
Thanks, the flow looks in order, I will need the logs to tell you more

**Comment by jemarr** [comment]
I just have access to RBPi via SSH or Node-Red web

**Comment by FezVrasta** [comment]
You would have to start Node-RED while logged in through SSH, first you will have to update your Node-RED config to set logging level to `trace` or `debug`

**Comment by jemarr** [comment]
![image](https://github.com/FezVrasta/node-red-matter/assets/22809959/260b3bf6-c438-4963-bfa4-4ff25a01f6fc)
![image](https://github.com/FezVrasta/node-red-matter/assets/22809959/e3375aa3-5bbb-4a9b-b0bc-d6e169179f74)

**Comment by FezVrasta** [comment]
`journalctl -u node-red` should give you all the logs. Check that, then try to pair to the virtual matter device, reproduce the issue, check the logs again and post them here

**Comment by jemarr** [comment]
[After start nodered.txt](https://github.com/FezVrasta/node-red-matter/files/12551123/After.start.nodered.txt)
[After detect device.txt](https://github.com/FezVrasta/node-red-matter/files/12551124/After.detect.device.txt)

Those are the logs, just after starting Node-Red, and after trying to detect from iPhone Home app

**Comment by FezVrasta** [comment]
Can't see anything wrong, but I'm no expert in matter.js, you could try asking in the Discord channel to see if someone else can provide more help.

**Comment by jemarr** [comment]
ok, thanks

**Comment by scargill** [comment]
Installed, your example set up, using my Google Home Speaker hub device -.. Cant seem to find the QR code to feed into the Google Home device. Your info says documentation on the WIKI but I could ontly find one line of text in there. Am I missing something major here?

**Comment by jemarr** [comment]
Just, deploy in Node-Red and go to configure  the device node again, then QR code should be there.

**Comment by Apollon77** [comment]
In fact the above logs just show the announcements but noone that tries to catch up or connect. This most likely means issues in UDP/MDNS/IPv6 data flows.

* So make sure (especially with Google) your network has enabled IPv6
* make sure all parties (the host with the device running on/node-red, the hub, the mobile app) and all interact with each other and are in the same network and UDP package flow is not blocked

Especially with Docker (no idea if you use it) that all might get interesting

Once it works and after scanning the qr code you should see at least "incoming" traffic when the mobile app was able to discover the device

**Comment by jemarr** [comment]
Thanks Apollon, I'll check.

**Comment by jemarr** [comment]
i've checked IPv6 on router and NanoPi and both are enabled
NanoPi is connected to the router via Ethernet cable and my iPhone/Android devices via WiFi to the same router, means same network.

![image](https://github.com/FezVrasta/node-red-matter/assets/22809959/87d15e87-6a3c-4e0a-9b3e-0a9d8b38a191)

Don't know how to check UDP flow

I don't use docker, just installed DietPi on my NanoPi Neo and Node-Red (with Dietpi-Software)
Quite simple installation. And just Matter node plugin

**Comment by Apollon77** [comment]
Its there any Firewall active on the device?

**Comment by jemarr** [comment]
Not on NanoPi-Dietpi device,
May be in the Router for in-outgoing traffic

**Comment by Apollon77** [comment]
Check all router settings

**Comment by Apollon77** [comment]
What does "ip a" outouts onthe dietpi?

**Comment by jemarr** [comment]
> What does "ip a" outouts onthe dietpi?

Where do you see it ?, Sorry I can't find this item

**Comment by jemarr** [comment]
I've checked all menus on router and nothing wrong I guess

**Comment by scargill** [comment]
> Just, deploy in Node-Red and go to configure the device node again, then QR code should be there. ![image](https://user-images.githubusercontent.com/22809959/266571967-a71c2487-aba1-4339-94f2-745b8a5ad938.png)

Not entirely sure what I'm supposed to put in the mnatter serverr section. I ahev the Google Home Speake unit whi wmakes other Matter devices work..

I went to the example and.. 
Pairing
Unable to retrieve pairing data. Make sure you deployed the node first, and that the associated Matter server is running.

**Comment by Apollon77** [comment]
> Where do you see it ?, Sorry I can't find this item

enter in a SSH shell

**Comment by jemarr** [comment]
> 

root@DietPi:~# ip a
1: lo: <LOOPBACK,UP,LOWER_UP> mtu 65536 qdisc noqueue state UNKNOWN group default qlen 1000
    link/loopback 00:00:00:00:00:00 brd 00:00:00:00:00:00
    inet 127.0.0.1/8 scope host lo
       valid_lft forever preferred_lft forever
    inet6 ::1/128 scope host noprefixroute
       valid_lft forever preferred_lft forever
2: eth0: <BROADCAST,MULTICAST,UP,LOWER_UP> mtu 1500 qdisc mq state UP group default qlen 1000
    link/ether 02:81:69:a6:58:a3 brd ff:ff:ff:ff:ff:ff
    inet 192.168.1.13/24 brd 192.168.1.255 scope global eth0
       valid_lft forever preferred_lft forever
    inet6 fe80::81:69ff:fea6:58a3/64 scope link
       valid_lft forever preferred_lft forever

**Comment by Apollon77** [comment]
Ok that looks ok in general ... sotr honestly no idea ...

**Comment by jemarr** [comment]
Ok,

Thanks for your time !!!

**Comment by Apollon77** [comment]
But let me phrase it that way: If you find it out that would be cool. In fact if you tried Google maybe also Try Tuya Smartlife App 8works without an App) or Apple (if you have a hub). There mus be a reason.
You could also try the "ESP Rainmaker app" ... just to try other things

I personally have this issue that all ecosystems do work beside Alex ... it also never finds and I have no clue why :-(

**Comment by Apollon77** [comment]
PS: mabe try to connect your dietpi via wifi (too) .. if it then works there is maybe an issue with wifi vs lan UDP routing

**Comment by jemarr** [comment]
ok

**Comment by scargill** [comment]
I guess I should have started a separate subject as I've no idea if any of these replies are for me.... this onw oudl nto have been for me...
```
pi@mainpi:~:17:32[130]> tcpdump -i all port 5353
tcpdump: all: You don't have permission to capture on that device
(socket: Operation not permitted)
```

**Comment by Apollon77** [comment]
@scargill "permission" ... try sudo?

**Comment by Apollon77** [comment]
@itsopti ohh yes this could also be, IF it changes anything else on the system ... in fact matter,js is not using avahi service ... but if mdns is not available "at all" withiut it then yes might be an idea to try

**Comment by itsopti** [comment]
Yes, sudo ofc, sorry should ve mentioned it.
This should be the case for everyone using "plain linux" as an OS.  (Not using NR as addon in HA)

@Apollon77 Matter.js does not need to use a specific service. This should be an OSI-Layer thing i guess. Avahi receives and forwards the mdns pakets to the OS where any program can work with it. As long as any service this receiving and forwarding those network pakets we are fine.

@scargill i am sorry, im on the phone right now. It should be tcpdump -i any port 5353
Maybe take a look in the help page to understand what those parameters mean

**Comment by scargill** [comment]
> @scargill i am sorry, im on the phone right now. It should be tcpdump -i any port 5353 Maybe take a look in the help page to understand what those parameters mean

Clarification I'm using bog-standard Raspberry Pi operating system, not lite, not using HA or Docker.

That any port option just raised a SHEDLOAD od response - not sure gibhub will let me put it in here.

```
pi@mainpi:~:18:59[130]> sudo tcpdump -i any port 5353
tcpdump: verbose output suppressed, use -v or -vv for full protocol decode
listening on any, link-type LINUX_SLL (Linux cooked), capture size 262144 bytes
19:09:04.941814 IP espressif.lan.mdns > 224.0.0.251.mdns: 0*- [0q] 4/0/0 PTR _ewelink._tcp.local., PTR eWeLink_1001720e47._ewelink._tcp.local., (Cache flush) SRV eWeLink_1001720e47.local.:8081 0 0, (Cache flush) TXT "data3=FYChz3bMNrp7esV1D1" "data2=IhKyiI1vNjkuc6DiT9hmACBao1uqFC6/4KnuK9NpBEwULgVczlcOvUw82IzmQiPP2QfOSiy7O9RFknVAnuMwc7xrRiqE61fED6xT90gds9UlBHNur2Iku4Zc80/xlsVvLTx1KGlxCkxG6g8mZhrotR1VTpARg4LZNI1tVYoQdXEz5ReLnw+RoHxHbP90jw4JLMuLEl0T5BDOTHR23mXV0y5qBv2wliF9f/eihSbRISaULW5p+vhWbrq" "data1=5LYMKT87ADrfjiXWMpnVImh3kDCRtpkvaH0LV14SjEWEfw0ZB4GVWsklrMOji61meeL+eoUnojgVmgWFTUc9qqCJwoY5lzGdaDRFtuwejw+YvoVPrAE9TH9I+PxSwmC/B3XAFpA6xibbFGLepv9tBb5lPRT5tb9BlQH9AmdStRXljYMAK/ue7ZdV9cfm6NcZg5cS3VR/VcnkexJc2BWa3CbTlS705YOwGAlBMN8H4pi8STLOBZHuWzW" "seq=91734" "iv=MDEzNjYzNTE3ODQyMTk1Ng==" "encrypt=true" "apivers=1" "type=th_plug" "id=1001720e47" "txtvers=1" (845)
19:09:05.051363 IP6 fe80::bad6:1aff:fea6:a364.mdns > ff02::fb.mdns: 0*- [0q] 4/0/0 PTR _ewelink._tcp.local., PTR eWeLink_1001720e47._ewelink._tcp.local., (Cache flush) SRV eWeLink_1001720e47.local.:8081 0 0, (Cache flush) TXT "data3=FYChz3bMNrp7esV1D1" "data2=IhKyiI1vNjkuc6DiT9hmACBao1uqFC6/4KnuK9NpBEwULgVczlcOvUw82IzmQiPP2QfOSiy7O9RFknVAnuMwc7xrRiqE61fED6xT90gds9UlBHNur2Iku4Zc80/xlsVvLTx1KGlxCkxG6g8mZhrotR1VTpARg4LZNI1tVYoQdXEz5ReLnw+RoHxHbP90jw4JLMuLEl0T5BDOTHR23mXV0y5qBv2wliF9f/eihSbRISaULW5p+vhWbrq" "data1=5LYMKT87ADrfjiXWMpnVImh3kDCRtpkvaH0LV14SjEWEfw0ZB4GVWsklrMOji61meeL+eoUnojgVmgWFTUc9qqCJwoY5lzGdaDRFtuwejw+YvoVPrAE9TH9I+PxSwmC/B3XAFpA6xibbFGLepv9tBb5lPRT5tb9BlQH9AmdStRXljYMAK/ue7ZdV9cfm6NcZg5cS3VR/VcnkexJc2BWa3CbTlS705YOwGAlBMN8H4pi8STLOBZHuWzW" "seq=91734" "iv=MDEzNjYzNTE3ODQyMTk1Ng==" "encrypt=true" "apivers=1" "type=th_plug" "id=1001720e47" "txtvers=1" (845)
19:09:05.139500 IP espressif.lan.mdns > 224.0.0.251.mdns: 0*- [0q] 4/0/0 PTR _ewelink._tcp.local., PTR eWeLink_1001720e47._ewelink._tcp.local., (Cache flush) SRV eWeLink_1001720e47.local.:8081 0 0, (Cache flush) TXT "data3=FYChz3bMNrp7esV1D1" "data2=IhKyiI1vNjkuc6DiT9hmACBao1uqFC6/4KnuK9NpBEwULgVczlcOvUw82IzmQiPP2QfOSiy7O9RFknVAnuMwc7xrRiqE61fED6xT90gds9UlBHNur2Iku4Zc80/xlsVvLTx1KGlxCkxG6g8mZhrotR1VTpARg4LZNI1tVYoQdXEz5ReLnw+RoHxHbP90jw4JLMuLEl0T5BDOTHR23mXV0y5qBv2wliF9f/eihSbRISaULW5p+vhWbrq" "data1=5LYMKT87ADrfjiXWMpnVImh3kDCRtpkvaH0LV14SjEWEfw0ZB4GVWsklrMOji61meeL+eoUnojgVmgWFTUc9qqCJwoY5lzGdaDRFtuwejw+YvoVPrAE9TH9I+PxSwmC/B3XAFpA6xibbFGLepv9tBb5lPRT5tb9BlQH9AmdStRXljYMAK/ue7ZdV9cfm6NcZg5cS3VR/VcnkexJc2BWa3CbTlS705YOwGAlBMN8H4pi8STLOBZHuWzW" "seq=91734" "iv=MDEzNjYzNTE3ODQyMTk1Ng==" "encrypt=true" "apivers=1" "type=th_plug" "id=1001720e47" "txtvers=1" (864)
19:09:05.241141 IP6 fe80::bad6:1aff:fea6:a364.mdns > ff02::fb.mdns: 0*- [0q] 4/0/0 PTR _ewelink._tcp.local., PTR eWeLink_1001720e47._ewelink._tcp.local., (Cache flush) SRV eWeLink_1001720e47.local.:8081 0 0, (Cache flush) TXT "data3=FYChz3bMNrp7esV1D1" "data2=IhKyiI1vNjkuc6DiT9hmACBao1uqFC6/4KnuK9NpBEwULgVczlcOvUw82IzmQiPP2QfOSiy7O9RFknVAnuMwc7xrRiqE61fED6xT90gds9UlBHNur2Iku4Zc80/xlsVvLTx1KGlxCkxG6g8mZhrotR1VTpARg4LZNI1tVYoQdXEz5ReLnw+RoHxHbP90jw4JLMuLEl0T5BDOTHR23mXV0y5qBv2wliF9f/eihSbRISaULW5p+vhWbrq" "data1=5LYMKT87ADrfjiXWMpnVImh3kDCRtpkvaH0LV14SjEWEfw0ZB4GVWsklrMOji61meeL+eoUnojgVmgWFTUc9qqCJwoY5lzGdaDRFtuwejw+YvoVPrAE9TH9I+PxSwmC/B3XAFpA6xibbFGLepv9tBb5lPRT5tb9BlQH9AmdStRXljYMAK/ue7ZdV9cfm6NcZg5cS3VR/VcnkexJc2BWa3CbTlS705YOwGAlBMN8H4pi8STLOBZHuWzW" "seq=91734" "iv=MDEzNjYzNTE3ODQyMTk1Ng==" "encrypt=true" "apivers=1" "type=th_plug" "id=1001720e47" "txtvers=1" (845)
19:09:05.341746 IP espressif.lan.mdns > 224.0.0.251.mdns: 0*- [0q] 4/0/0 PTR _ewelink._tcp.local., PTR eWeLink_1001720e47._ewelink._tcp.local., (Cache flush) SRV eWeLink_1001720e47.local.:8081 0 0, (Cache flush) TXT "data3=FYChz3bMNrp7esV1D1" "data2=IhKyiI1vNjkuc6DiT9hmACBao1uqFC6/4KnuK9NpBEwULgVczlcOvUw82IzmQiPP2QfOSiy7O9RFknVAnuMwc7xrRiqE61fED6xT90gds9UlBHNur2Iku4Zc80/xlsVvLTx1KGlxCkxG6g8mZhrotR1VTpARg4LZNI1tVYoQdXEz5ReLnw+RoHxHbP90jw4JLMuLEl0T5BDOTHR23mXV0y5qBv2wliF9f/eihSbRISaULW5p+vhWbrq" "data1=5LYMKT87ADrfjiXWMpnVImh3kDCRtpkvaH0LV14SjEWEfw0ZB4GVWsklrMOji61meeL+eoUnojgVmgWFTUc9qqCJwoY5lzGdaDRFtuwejw+YvoVPrAE9TH9I+PxSwmC/B3XAFpA6xibbFGLepv9tBb5lPRT5tb9BlQH9AmdStRXljYMAK/ue7ZdV9cfm6NcZg5cS3VR/VcnkexJc2BWa3CbTlS705YOwGAlBMN8H4pi8STLOBZHuWzW" "seq=91734" "iv=MDEzNjYzNTE3ODQyMTk1Ng==" "encrypt=true" "apivers=1" "type=th_plug" "id=1001720e47" "txtvers=1" (840)
19:09:05.446770 IP6 fe80::bad6:1aff:fea6:a364.mdns > ff02::fb.mdns: 0*- [0q] 4/0/0 PTR _ewelink._tcp.local., PTR eWeLink_1001720e47._ewelink._tcp.local., (Cache flush) SRV eWeLink_1001720e47.local.:8081 0 0, (Cache flush) TXT "data3=FYChz3bMNrp7esV1D1" "data2=IhKyiI1vNjkuc6DiT9hmACBao1uqFC6/4KnuK9NpBEwULgVczlcOvUw82IzmQiPP2QfOSiy7O9RFknVAnuMwc7xrRiqE61fED6xT90gds9UlBHNur2Iku4Zc80/xlsVvLTx1KGlxCkxG6g8mZhrotR1VTpARg4LZNI1tVYoQdXEz5ReLnw+RoHxHbP90jw4JLMuLEl0T5BDOTHR23mXV0y5qBv2wliF9f/eihSbRISaULW5p+vhWbrq" "data1=5LYMKT87ADrfjiXWMpnVImh3kDCRtpkvaH0LV14SjEWEfw0ZB4GVWsklrMOji61meeL+eoUnojgVmgWFTUc9qqCJwoY5lzGdaDRFtuwejw+YvoVPrAE9TH9I+PxSwmC/B3XAFpA6xibbFGLepv9tBb5lPRT5tb9BlQH9AmdStRXljYMAK/ue7ZdV9cfm6NcZg5cS3VR/VcnkexJc2BWa3CbTlS705YOwGAlBMN8H4pi8STLOBZHuWzW" "seq=91734" "iv=MDEzNjYzNTE3ODQyMTk1Ng==" "encrypt=true" "apivers=1" "type=th_plug" "id=1001720e47" "txtvers=1" (840)
19:09:09.941304 IP espressif.lan.mdns > 224.0.0.251.mdns: 0*- [0q] 4/0/0 PTR _ewelink._tcp.local., PTR eWeLink_1001720e47._ewelink._tcp.local., (Cache flush) SRV eWeLink_1001720e47.local.:8081 0 0, (Cache flush) TXT "data3=XuyfcHJ8K13H16a1Su" "data2=FZZvCesU/2ReCHPGPFqPkPCcE7HsQiBWHnSfjAKp34CkZ10PSdkaiN70wWQUAXvJ9//3ZVx5eGSOcJrCZO7oHCs+nhGGgril0BQraMTWt1OsdjTnchc3+VzZaMg6eIIO0rT1UJG/dj2WOy7ROk8T7DiERqCTXbSPTiHOwtG+C9gP9KnD1EqIeRrC6UrbO0LwdXYthvJIieXd/VuqM8K4mHQP8BmUpSc1+emH+BswVyHZkVSlewI4IKG" "data1=B36JtMjSnUBc4MEiwM9lmLsUn5GeGh+mr7JMO2SqELKdJiem6b3aCkoN3UZwF18JTFzT6C2qMSt3hDwMQyWvPMNHf+OqOBEjstdqtnrZU91zVPOgsbMkhHoA9+QUwmqvL5tUfbZU0vbVSHnHo6FZDdhqv6xaS0Dam2hyJbR9oZlO+4uKXHm9jlk1Rb00Ai37j2Uw7Q6L/OwkHx8kpLYkVlqgodyXliTpdj6UYMLJMWxbPdzs0HN+AaG" "seq=91735" "iv=NjcxOTUxOTAwNDY2NDkzOA==" "encrypt=true" "apivers=1" "type=th_plug" "id=1001720e47" "txtvers=1" (845)
19:09:10.052840 IP6 fe80::bad6:1aff:fea6:a364.mdns > ff02::fb.mdns: 0*- [0q] 4/0/0 PTR _ewelink._tcp.local., PTR eWeLink_1001720e47._ewelink._tcp.local., (Cache flush) SRV eWeLink_1001720e47.local.:8081 0 0, (Cache flush) TXT "data3=XuyfcHJ8K13H16a1Su" "data2=FZZvCesU/2ReCHPGPFqPkPCcE7HsQiBWHnSfjAKp34CkZ10PSdkaiN70wWQUAXvJ9//3ZVx5eGSOcJrCZO7oHCs+nhGGgril0BQraMTWt1OsdjTnchc3+VzZaMg6eIIO0rT1UJG/dj2WOy7ROk8T7DiERqCTXbSPTiHOwtG+C9gP9KnD1EqIeRrC6UrbO0LwdXYthvJIieXd/VuqM8K4mHQP8BmUpSc1+emH+BswVyHZkVSlewI4IKG" "data1=B36JtMjSnUBc4MEiwM9lmLsUn5GeGh+mr7JMO2SqELKdJiem6b3aCkoN3UZwF18JTFzT6C2qMSt3hDwMQyWvPMNHf+OqOBEjstdqtnrZU91zVPOgsbMkhHoA9+QUwmqvL5tUfbZU0vbVSHnHo6FZDdhqv6xaS0Dam2hyJbR9oZlO+4uKXHm9jlk1Rb00Ai37j2Uw7Q6L/OwkHx8kpLYkVlqgodyXliTpdj6UYMLJMWxbPdzs0HN+AaG" "seq=91735" "iv=NjcxOTUxOTAwNDY2NDkzOA==" "encrypt=true" "apivers=1" "type=th_plug" "id=1001720e47" "txtvers=1" (845)
19:09:10.141171 IP espressif.lan.mdns > 224.0.0.251.mdns: 0*- [0q] 4/0/0 PTR _ewelink._tcp.local., PTR eWeLink_1001720e47._ewelink._tcp.local., (Cache flush) SRV eWeLink_1001720e47.local.:8081 0 0, (Cache flush) TXT "data3=XuyfcHJ8K13H16a1Su" "data2=FZZvCesU/2ReCHPGPFqPkPCcE7HsQiBWHnSfjAKp34CkZ10PSdkaiN70wWQUAXvJ9//3ZVx5eGSOcJrCZO7oHCs+nhGGgril0BQraMTWt1OsdjTnchc3+VzZaMg6eIIO0rT1UJG/dj2WOy7ROk8T7DiERqCTXbSPTiHOwtG+C9gP9KnD1EqIeRrC6UrbO0LwdXYthvJIieXd/VuqM8K4mHQP8BmUpSc1+emH+BswVyHZkVSlewI4IKG" "data1=B36JtMjSnUBc4MEiwM9lmLsUn5GeGh+mr7JMO2SqELKdJiem6b3aCkoN3UZwF18JTFzT6C2qMSt3hDwMQyWvPMNHf+OqOBEjstdqtnrZU91zVPOgsbMkhHoA9+QUwmqvL5tUfbZU0vbVSHnHo6FZDdhqv6xaS0Dam2hyJbR9oZlO+4uKXHm9jlk1Rb00Ai37j2Uw7Q6L/OwkHx8kpLYkVlqgodyXliTpdj6UYMLJMWxbPdzs0HN+AaG" "seq=91735" "iv=NjcxOTUxOTAwNDY2NDkzOA==" "encrypt=true" "apivers=1" "type=th_plug" "id=1001720e47" "txtvers=1" (845)
19:09:10.245243 IP6 fe80::bad6:1aff:fea6:a364.mdns > ff02::fb.mdns: 0*- [0q] 4/0/0 PTR _ewelink._tcp.local., PTR eWeLink_1001720e47._ewelink._tcp.local., (Cache flush) SRV eWeLink_1001720e47.local.:8081 0 0, (Cache flush) TXT "data3=XuyfcHJ8K13H16a1Su" "data2=FZZvCesU/2ReCHPGPFqPkPCcE7HsQiBWHnSfjAKp34CkZ10PSdkaiN70wWQUAXvJ9//3ZVx5eGSOcJrCZO7oHCs+nhGGgril0BQraMTWt1OsdjTnchc3+VzZaMg6eIIO0rT1UJG/dj2WOy7ROk8T7DiERqCTXbSPTiHOwtG+C9gP9KnD1EqIeRrC6UrbO0LwdXYthvJIieXd/VuqM8K4mHQP8BmUpSc1+emH+BswVyHZkVSlewI4IKG" "data1=B36JtMjSnUBc4MEiwM9lmLsUn5GeGh+mr7JMO2SqELKdJiem6b3aCkoN3UZwF18JTFzT6C2qMSt3hDwMQyWvPMNHf+OqOBEjstdqtnrZU91zVPOgsbMkhHoA9+QUwmqvL5tUfbZU0vbVSHnHo6FZDdhqv6xaS0Dam2hyJbR9oZlO+4uKXHm9jlk1Rb00Ai37j2Uw7Q6L/OwkHx8kpLYkVlqgodyXliTpdj6UYMLJMWxbPdzs0HN+AaG" "seq=91735" "iv=NjcxOTUxOTAwNDY2NDkzOA==" "encrypt=true" "apivers=1" "type=th_plug" "id=1001720e47" "txtvers=1" (845)
19:09:10.338762 IP espressif.lan.mdns > 224.0.0.251.mdns: 0*- [0q] 4/0/0 PTR _ewelink._tcp.local., PTR eWeLink_1001720e47._ewelink._tcp.local., (Cache flush) SRV eWeLink_1001720e47.local.:8081 0 0, (Cache flush) TXT "data3=XuyfcHJ8K13H16a1Su" "data2=FZZvCesU/2ReCHPGPFqPkPCcE7HsQiBWHnSfjAKp34CkZ10PSdkaiN70wWQUAXvJ9//3ZVx5eGSOcJrCZO7oHCs+nhGGgril0BQraMTWt1OsdjTnchc3+VzZaMg6eIIO0rT1UJG/dj2WOy7ROk8T7DiERqCTXbSPTiHOwtG+C9gP9KnD1EqIeRrC6UrbO0LwdXYthvJIieXd/VuqM8K4mHQP8BmUpSc1+emH+BswVyHZkVSlewI4IKG" "data1=B36JtMjSnUBc4MEiwM9lmLsUn5GeGh+mr7JMO2SqELKdJiem6b3aCkoN3UZwF18JTFzT6C2qMSt3hDwMQyWvPMNHf+OqOBEjstdqtnrZU91zVPOgsbMkhHoA9+QUwmqvL5tUfbZU0vbVSHnHo6FZDdhqv6xaS0Dam2hyJbR9oZlO+4uKXHm9jlk1Rb00Ai37j2Uw7Q6L/OwkHx8kpLYkVlqgodyXliTpdj6UYMLJMWxbPdzs0HN+AaG" "seq=91735" "iv=NjcxOTUxOTAwNDY2NDkzOA==" "encrypt=true" "apivers=1" "type=th_plug" "id=1001720e47" "txtvers=1" (845)
19:09:10.440910 IP6 fe80::bad6:1aff:fea6:a364.mdns > ff02::fb.mdns: 0*- [0q] 4/0/0 PTR _ewelink._tcp.local., PTR eWeLink_1001720e47._ewelink._tcp.local., (Cache flush) SRV eWeLink_1001720e47.local.:8081 0 0, (Cache flush) TXT "data3=XuyfcHJ8K13H16a1Su" "data2=FZZvCesU/2ReCHPGPFqPkPCcE7HsQiBWHnSfjAKp34CkZ10PSdkaiN70wWQUAXvJ9//3ZVx5eGSOcJrCZO7oHCs+nhGGgril0BQraMTWt1OsdjTnchc3+VzZaMg6eIIO0rT1UJG/dj2WOy7ROk8T7DiERqCTXbSPTiHOwtG+C9gP9KnD1EqIeRrC6UrbO0LwdXYthvJIieXd/VuqM8K4mHQP8BmUpSc1+emH+BswVyHZkVSlewI4IKG" "data1=B36JtMjSnUBc4MEiwM9lmLsUn5GeGh+mr7JMO2SqELKdJiem6b3aCkoN3UZwF18JTFzT6C2qMSt3hDwMQyWvPMNHf+OqOBEjstdqtnrZU91zVPOgsbMkhHoA9+QUwmqvL5tUfbZU0vbVSHnHo6FZDdhqv6xaS0Dam2hyJbR9oZlO+4uKXHm9jlk1Rb00Ai37j2Uw7Q6L/OwkHx8kpLYkVlqgodyXliTpdj6UYMLJMWxbPdzs0HN+AaG" "seq=91735" "iv=NjcxOTUxOTAwNDY2NDkzOA==" "encrypt=true" "apivers=1" "type=th_plug" "id=1001720e47" "txtvers=1" (845)
19:09:12.451863 IP newbee.lan.mdns > 224.0.0.251.mdns: 0*- [0q] 9/0/0 PTR 7403b944-5066-41a2-83cc-1a0519637f24._agentdvr._tcp.local., SRV 7403b944-5066-41a2-83cc-1a0519637f24.agentdvr.local.:8090 0 0, TXT "txtvers=1" "HTTPS=false", AAAA fe80::d8ff:5060:f230:9168, A 100.84.207.33, AAAA fe80::4c96:4b04:1826:875b, A 192.168.1.177, AAAA fe80::bf89:c1ae:ac64:b31f, A 192.168.195.32 (315)
19:09:13.473577 IP newbee.lan.mdns > 224.0.0.251.mdns: 0*- [0q] 9/0/0 PTR 7403b944-5066-41a2-83cc-1a0519637f24._agentdvr._tcp.local., SRV 7403b944-5066-41a2-83cc-1a0519637f24.agentdvr.local.:8090 0 0, TXT "txtvers=1" "HTTPS=false", AAAA fe80::d8ff:5060:f230:9168, A 100.84.207.33, AAAA fe80::4c96:4b04:1826:875b, A 192.168.1.177, AAAA fe80::bf89:c1ae:ac64:b31f, A 192.168.195.32 (315)
19:09:14.941260 IP espressif.lan.mdns > 224.0.0.251.mdns: 0*- [0q] 4/0/0 PTR _ewelink._tcp.local., PTR eWeLink_1001720e47._ewelink._tcp.local., (Cache flush) SRV eWeLink_1001720e47.local.:8081 0 0, (Cache flush) TXT "data3=eqhyfWWiR182TBxLOJ" "data2=MvfD/ImV8wVGykLtBscLGWU1bMOmBoXMBq1QADe9AnK67Zaep+bgUgevGkKXxvCLabqBSlMR0HiqezWiRsSimpHKQElCBzHuW3Gxp5e6VobhD4XTonR3MFpdFmnzI6tT01RgwPKPnzuzRZKvqGw3zsRopyuL67Ws0dib9xpy8dQgUG4lRH9/MtoZlGV07mgfL3B+DevfdQY403l8F3UKN65G9N+jr8dkR8irFKnO/oCpIoBkc/Ri6vH" "data1=NXYMgsxV4J8BM7vPH3kTk7b7bOwWMkrE2QPAqHgGJ6eOg9920q4IapAbsZM+mexnU7g/veFrSDUcvoo0YeMP56vKf2bOCdzo8vhjFzGkqW8N1piPQ/7nWxQhTu9BJT+5Px8AHMZsyHFqdZAJR1ggBcvQJ7YqgzlHFcMbr1FdQvXst5iGYi7FbOhYNRKWR4KNO9BTO/pQFs/fUVEBUMtQUlnizWnA8bSa+fonnIEtrK6zwjPz9hRCw6p" "seq=91736" "iv=NDUyMDYxNzExNDk2NTUzNw==" "encrypt=true" "apivers=1" "type=th_plug" "id=1001720e47" "txtvers=1" (864)
19:09:15.041117 IP6 fe80::bad6:1aff:fea6:a364.mdns > ff02::fb.mdns: 0*- [0q] 4/0/0 PTR _ewelink._tcp.local., PTR eWeLink_1001720e47._ewelink._tcp.local., (Cache flush) SRV eWeLink_1001720e47.local.:8081 0 0, (Cache flush) TXT "data3=eqhyfWWiR182TBxLOJ" "data2=MvfD/ImV8wVGykLtBscLGWU1bMOmBoXMBq1QADe9AnK67Zaep+bgUgevGkKXxvCLabqBSlMR0HiqezWiRsSimpHKQElCBzHuW3Gxp5e6VobhD4XTonR3MFpdFmnzI6tT01RgwPKPnzuzRZKvqGw3zsRopyuL67Ws0dib9xpy8dQgUG4lRH9/MtoZlGV07mgfL3B+DevfdQY403l8F3UKN65G9N+jr8dkR8irFKnO/oCpIoBkc/Ri6vH" "data1=NXYMgsxV4J8BM7vPH3kTk7b7bOwWMkrE2QPAqHgGJ6eOg9920q4IapAbsZM+mexnU7g/veFrSDUcvoo0YeMP56vKf2bOCdzo8vhjFzGkqW8N1piPQ/7nWxQhTu9BJT+5Px8AHMZsyHFqdZAJR1ggBcvQJ7YqgzlHFcMbr1FdQvXst5iGYi7FbOhYNRKWR4KNO9BTO/pQFs/fUVEBUMtQUlnizWnA8bSa+fonnIEtrK6zwjPz9hRCw6p" "seq=91736" "iv=NDUyMDYxNzExNDk2NTUzNw==" "encrypt=true" "apivers=1" "type=th_plug" "id=1001720e47" "txtvers=1" (845)
19:09:15.140922 IP espressif.lan.mdns > 224.0.0.251.mdns: 0*- [0q] 4/0/0 PTR _ewelink._tcp.local., PTR eWeLink_1001720e47._ewelink._tcp.local., (Cache flush) SRV eWeLink_1001720e47.local.:8081 0 0, (Cache flush) TXT "data3=eqhyfWWiR182TBxLOJ" "data2=MvfD/ImV8wVGykLtBscLGWU1bMOmBoXMBq1QADe9AnK67Zaep+bgUgevGkKXxvCLabqBSlMR0HiqezWiRsSimpHKQElCBzHuW3Gxp5e6VobhD4XTonR3MFpdFmnzI6tT01RgwPKPnzuzRZKvqGw3zsRopyuL67Ws0dib9xpy8dQgUG4lRH9/MtoZlGV07mgfL3B+DevfdQY403l8F3UKN65G9N+jr8dkR8irFKnO/oCpIoBkc/Ri6vH" "data1=NXYMgsxV4J8BM7vPH3kTk7b7bOwWMkrE2QPAqHgGJ6eOg9920q4IapAbsZM+mexnU7g/veFrSDUcvoo0YeMP56vKf2bOCdzo8vhjFzGkqW8N1piPQ/7nWxQhTu9BJT+5Px8AHMZsyHFqdZAJR1ggBcvQJ7YqgzlHFcMbr1FdQvXst5iGYi7FbOhYNRKWR4KNO9BTO/pQFs/fUVEBUMtQUlnizWnA8bSa+fonnIEtrK6zwjPz9hRCw6p" "seq=91736" "iv=NDUyMDYxNzExNDk2NTUzNw==" "encrypt=true" "apivers=1" "type=th_plug" "id=1001720e47" "txtvers=1" (845)
19:09:15.241086 IP6 fe80::bad6:1aff:fea6:a364.mdns > ff02::fb.mdns: 0*- [0q] 4/0/0 PTR _ewelink._tcp.local., PTR eWeLink_1001720e47._ewelink._tcp.local., (Cache flush) SRV eWeLink_1001720e47.local.:8081 0 0, (Cache flush) TXT "data3=eqhyfWWiR182TBxLOJ" "data2=MvfD/ImV8wVGykLtBscLGWU1bMOmBoXMBq1QADe9AnK67Zaep+bgUgevGkKXxvCLabqBSlMR0HiqezWiRsSimpHKQElCBzHuW3Gxp5e6VobhD4XTonR3MFpdFmnzI6tT01RgwPKPnzuzRZKvqGw3zsRopyuL67Ws0dib9xpy8dQgUG4lRH9/MtoZlGV07mgfL3B+DevfdQY403l8F3UKN65G9N+jr8dkR8irFKnO/oCpIoBkc/Ri6vH" "data1=NXYMgsxV4J8BM7vPH3kTk7b7bOwWMkrE2QPAqHgGJ6eOg9920q4IapAbsZM+mexnU7g/veFrSDUcvoo0YeMP56vKf2bOCdzo8vhjFzGkqW8N1piPQ/7nWxQhTu9BJT+5Px8AHMZsyHFqdZAJR1ggBcvQJ7YqgzlHFcMbr1FdQvXst5iGYi7FbOhYNRKWR4KNO9BTO/pQFs/fUVEBUMtQUlnizWnA8bSa+fonnIEtrK6zwjPz9hRCw6p" "seq=91736" "iv=NDUyMDYxNzExNDk2NTUzNw==" "encrypt=true" "apivers=1" "type=th_plug" "id=1001720e47" "txtvers=1" (845)
19:09:15.340995 IP espressif.lan.mdns > 224.0.0.251.mdns: 0*- [0q] 4/0/0 PTR _ewelink._tcp.local., PTR eWeLink_1001720e47._ewelink._tcp.local., (Cache flush) SRV eWeLink_1001720e47.local.:8081 0 0, (Cache flush) TXT "data3=eqhyfWWiR182TBxLOJ" "data2=MvfD/ImV8wVGykLtBscLGWU1bMOmBoXMBq1QADe9AnK67Zaep+bgUgevGkKXxvCLabqBSlMR0HiqezWiRsSimpHKQElCBzHuW3Gxp5e6VobhD4XTonR3MFpdFmnzI6tT01RgwPKPnzuzRZKvqGw3zsRopyuL67Ws0dib9xpy8dQgUG4lRH9/MtoZlGV07mgfL3B+DevfdQY403l8F3UKN65G9N+jr8dkR8irFKnO/oCpIoBkc/Ri6vH" "data1=NXYMgsxV4J8BM7vPH3kTk7b7bOwWMkrE2QPAqHgGJ6eOg9920q4IapAbsZM+mexnU7g/veFrSDUcvoo0YeMP56vKf2bOCdzo8vhjFzGkqW8N1piPQ/7nWxQhTu9BJT+5Px8AHMZsyHFqdZAJR1ggBcvQJ7YqgzlHFcMbr1FdQvXst5iGYi7FbOhYNRKWR4KNO9BTO/pQFs/fUVEBUMtQUlnizWnA8bSa+fonnIEtrK6zwjPz9hRCw6p" "seq=91736" "iv=NDUyMDYxNzExNDk2NTUzNw==" "encrypt=true" "apivers=1" "type=th_plug" "id=1001720e47" "txtvers=1" (845)
19:09:15.440989 IP6 fe80::bad6:1aff:fea6:a364.mdns > ff02::fb.mdns: 0*- [0q] 4/0/0 PTR _ewelink._tcp.local., PTR eWeLink_1001720e47._ewelink._tcp.local., (Cache flush) SRV eWeLink_1001720e47.local.:8081 0 0, (Cache flush) TXT "data3=eqhyfWWiR182TBxLOJ" "data2=MvfD/ImV8wVGykLtBscLGWU1bMOmBoXMBq1QADe9AnK67Zaep+bgUgevGkKXxvCLabqBSlMR0HiqezWiRsSimpHKQElCBzHuW3Gxp5e6VobhD4XTonR3MFpdFmnzI6tT01RgwPKPnzuzRZKvqGw3zsRopyuL67Ws0dib9xpy8dQgUG4lRH9/MtoZlGV07mgfL3B+DevfdQY403l8F3UKN65G9N+jr8dkR8irFKnO/oCpIoBkc/Ri6vH" "data1=NXYMgsxV4J8BM7vPH3kTk7b7bOwWMkrE2QPAqHgGJ6eOg9920q4IapAbsZM+mexnU7g/veFrSDUcvoo0YeMP56vKf2bOCdzo8vhjFzGkqW8N1piPQ/7nWxQhTu9BJT+5Px8AHMZsyHFqdZAJR1ggBcvQJ7YqgzlHFcMbr1FdQvXst5iGYi7FbOhYNRKWR4KNO9BTO/pQFs/fUVEBUMtQUlnizWnA8bSa+fonnIEtrK6zwjPz9hRCw6p" "seq=91736" "iv=NDUyMDYxNzExNDk2NTUzNw==" "encrypt=true" "apivers=1" "type=th_plug" "id=1001720e47" "txtvers=1" (845)
19:09:19.945003 IP espressif.lan.mdns > 224.0.0.251.mdns: 0*- [0q] 4/0/0 PTR _ewelink._tcp.local., PTR eWeLink_1001720e47._ewelink._tcp.local., (Cache flush) SRV eWeLink_1001720e47.local.:8081 0 0, (Cache flush) TXT "data3=iswcYBT5cvhqTkx/SY" "data2=At5qkzx704oae724xBIEqOWrW2W75meZ6Coqk48xwOW3G81jQy9HsNHrA/u6LzkgNIJS8dxtNzLfDpXSYX6GJN9NqeBicC1IA6DpX1ZLx7Guh4gQQn483EO0zFjB5lQAOx9ol+g2srHJ5GYqMGiaGKjmpUw+m8B/6sqIfQpeRY7LcZJE47uA7cJtnfYaln0OIrYrfLTzLnsqNPMIaem8QmnoZkj25TtwxiiFVjdrZBlIpRI6PVhoU5O" "data1=PFtzijBcPBqeeAcIJQN0H9twq5cfdjsXqBYf6o4mWTBxu1ECOb0cA1PQ8VbfeJuu3NJJXNZWvVLk0qIkZmghgmnVQUGULcXKgtXPR2sW4SKXrdp9liW6ZYkYbikkeoa/wrujj+8/bgSAl6Xyx/HF/4tp4Rlclrb8cqquEb2kqYDsGlah+AJ02cVqHUq42326HCJPBcurETWs2Bs6eW5/dnmZ5SOkU9MSZqRXa1NIdpbCKQhE5yDYc97" "seq=91737" "iv=NTEyMjQyNjk4MjYyNjA0Ng==" "encrypt=true" "apivers=1" "type=th_plug" "id=1001720e47" "txtvers=1" (845)
19:09:20.044249 IP6 fe80::bad6:1aff:fea6:a364.mdns > ff02::fb.mdns: 0*- [0q] 4/0/0 PTR _ewelink._tcp.local., PTR eWeLink_1001720e47._ewelink._tcp.local., (Cache flush) SRV eWeLink_1001720e47.local.:8081 0 0, (Cache flush) TXT "data3=iswcYBT5cvhqTkx/SY" "data2=At5qkzx704oae724xBIEqOWrW2W75meZ6Coqk48xwOW3G81jQy9HsNHrA/u6LzkgNIJS8dxtNzLfDpXSYX6GJN9NqeBicC1IA6DpX1ZLx7Guh4gQQn483EO0zFjB5lQAOx9ol+g2srHJ5GYqMGiaGKjmpUw+m8B/6sqIfQpeRY7LcZJE47uA7cJtnfYaln0OIrYrfLTzLnsqNPMIaem8QmnoZkj25TtwxiiFVjdrZBlIpRI6PVhoU5O" "data1=PFtzijBcPBqeeAcIJQN0H9twq5cfdjsXqBYf6o4mWTBxu1ECOb0cA1PQ8VbfeJuu3NJJXNZWvVLk0qIkZmghgmnVQUGULcXKgtXPR2sW4SKXrdp9liW6ZYkYbikkeoa/wrujj+8/bgSAl6Xyx/HF/4tp4Rlclrb8cqquEb2kqYDsGlah+AJ02cVqHUq42326HCJPBcurETWs2Bs6eW5/dnmZ5SOkU9MSZqRXa1NIdpbCKQhE5yDYc97" "seq=91737" "iv=NTEyMjQyNjk4MjYyNjA0Ng==" "encrypt=true" "apivers=1" "type=th_plug" "id=1001720e47" "txtvers=1" (845)
19:09:20.174132 IP espressif.lan.mdns > 224.0.0.251.mdns: 0*- [0q] 4/0/0 PTR _ewelink._tcp.local., PTR eWeLink_1001720e47._ewelink._tcp.local., (Cache flush) SRV eWeLink_1001720e47.local.:8081 0 0, (Cache flush) TXT "data3=iswcYBT5cvhqTkx/SY" "data2=At5qkzx704oae724xBIEqOWrW2W75meZ6Coqk48xwOW3G81jQy9HsNHrA/u6LzkgNIJS8dxtNzLfDpXSYX6GJN9NqeBicC1IA6DpX1ZLx7Guh4gQQn483EO0zFjB5lQAOx9ol+g2srHJ5GYqMGiaGKjmpUw+m8B/6sqIfQpeRY7LcZJE47uA7cJtnfYaln0OIrYrfLTzLnsqNPMIaem8QmnoZkj25TtwxiiFVjdrZBlIpRI6PVhoU5O" "data1=PFtzijBcPBqeeAcIJQN0H9twq5cfdjsXqBYf6o4mWTBxu1ECOb0cA1PQ8VbfeJuu3NJJXNZWvVLk0qIkZmghgmnVQUGULcXKgtXPR2sW4SKXrdp9liW6ZYkYbikkeoa/wrujj+8/bgSAl6Xyx/HF/4tp4Rlclrb8cqquEb2kqYDsGlah+AJ02cVqHUq42326HCJPBcurETWs2Bs6eW5/dnmZ5SOkU9MSZqRXa1NIdpbCKQhE5yDYc97" "seq=91737" "iv=NTEyMjQyNjk4MjYyNjA0Ng==" "encrypt=true" "apivers=1" "type=th_plug" "id=1001720e47" "txtvers=1" (840)
19:09:20.242035 IP6 fe80::bad6:1aff:fea6:a364.mdns > ff02::fb.mdns: 0*- [0q] 4/0/0 PTR _ewelink._tcp.local., PTR eWeLink_1001720e47._ewelink._tcp.local., (Cache flush) SRV eWeLink_1001720e47.local.:8081 0 0, (Cache flush) TXT "data3=iswcYBT5cvhqTkx/SY" "data2=At5qkzx704oae724xBIEqOWrW2W75meZ6Coqk48xwOW3G81jQy9HsNHrA/u6LzkgNIJS8dxtNzLfDpXSYX6GJN9NqeBicC1IA6DpX1ZLx7Guh4gQQn483EO0zFjB5lQAOx9ol+g2srHJ5GYqMGiaGKjmpUw+m8B/6sqIfQpeRY7LcZJE47uA7cJtnfYaln0OIrYrfLTzLnsqNPMIaem8QmnoZkj25TtwxiiFVjdrZBlIpRI6PVhoU5O" "data1=PFtzijBcPBqeeAcIJQN0H9twq5cfdjsXqBYf6o4mWTBxu1ECOb0cA1PQ8VbfeJuu3NJJXNZWvVLk0qIkZmghgmnVQUGULcXKgtXPR2sW4SKXrdp9liW6ZYkYbikkeoa/wrujj+8/bgSAl6Xyx/HF/4tp4Rlclrb8cqquEb2kqYDsGlah+AJ02cVqHUq42326HCJPBcurETWs2Bs6eW5/dnmZ5SOkU9MSZqRXa1NIdpbCKQhE5yDYc97" "seq=91737" "iv=NTEyMjQyNjk4MjYyNjA0Ng==" "encrypt=true" "apivers=1" "type=th_plug" "id=1001720e47" "txtvers=1" (845)
19:09:20.339888 IP espressif.lan.mdns > 224.0.0.251.mdns: 0*- [0q] 4/0/0 PTR _ewelink._tcp.local., PTR eWeLink_1001720e47._ewelink._tcp.local., (Cache flush) SRV eWeLink_1001720e47.local.:8081 0 0, (Cache flush) TXT "data3=iswcYBT5cvhqTkx/SY" "data2=At5qkzx704oae724xBIEqOWrW2W75meZ6Coqk48xwOW3G81jQy9HsNHrA/u6LzkgNIJS8dxtNzLfDpXSYX6GJN9NqeBicC1IA6DpX1ZLx7Guh4gQQn483EO0zFjB5lQAOx9ol+g2srHJ5GYqMGiaGKjmpUw+m8B/6sqIfQpeRY7LcZJE47uA7cJtnfYaln0OIrYrfLTzLnsqNPMIaem8QmnoZkj25TtwxiiFVjdrZBlIpRI6PVhoU5O" "data1=PFtzijBcPBqeeAcIJQN0H9twq5cfdjsXqBYf6o4mWTBxu1ECOb0cA1PQ8VbfeJuu3NJJXNZWvVLk0qIkZmghgmnVQUGULcXKgtXPR2sW4SKXrdp9liW6ZYkYbikkeoa/wrujj+8/bgSAl6Xyx/HF/4tp4Rlclrb8cqquEb2kqYDsGlah+AJ02cVqHUq42326HCJPBcurETWs2Bs6eW5/dnmZ5SOkU9MSZqRXa1NIdpbCKQhE5yDYc97" "seq=91737" "iv=NTEyMjQyNjk4MjYyNjA0Ng==" "encrypt=true" "apivers=1" "type=th_plug" "id=1001720e47" "txtvers=1" (845)
19:09:20.440562 IP6 fe80::bad6:1aff:fea6:a364.mdns > ff02::fb.mdns: 0*- [0q] 4/0/0 PTR _ewelink._tcp.local., PTR eWeLink_1001720e47._ewelink._tcp.local., (Cache flush) SRV eWeLink_1001720e47.local.:8081 0 0, (Cache flush) TXT "data3=iswcYBT5cvhqTkx/SY" "data2=At5qkzx704oae724xBIEqOWrW2W75meZ6Coqk48xwOW3G81jQy9HsNHrA/u6LzkgNIJS8dxtNzLfDpXSYX6GJN9NqeBicC1IA6DpX1ZLx7Guh4gQQn483EO0zFjB5lQAOx9ol+g2srHJ5GYqMGiaGKjmpUw+m8B/6sqIfQpeRY7LcZJE47uA7cJtnfYaln0OIrYrfLTzLnsqNPMIaem8QmnoZkj25TtwxiiFVjdrZBlIpRI6PVhoU5O" "data1=PFtzijBcPBqeeAcIJQN0H9twq5cfdjsXqBYf6o4mWTBxu1ECOb0cA1PQ8VbfeJuu3NJJXNZWvVLk0qIkZmghgmnVQUGULcXKgtXPR2sW4SKXrdp9liW6ZYkYbikkeoa/wrujj+8/bgSAl6Xyx/HF/4tp4Rlclrb8cqquEb2kqYDsGlah+AJ02cVqHUq42326HCJPBcurETWs2Bs6eW5/dnmZ5SOkU9MSZqRXa1NIdpbCKQhE5yDYc97" "seq=91737" "iv=NTEyMjQyNjk4MjYyNjA0Ng==" "encrypt=true" "apivers=1" "type=th_plug" "id=1001720e47" "txtvers=1" (845)
19:09:21.401879 IP shellyplusplugs-80646fd63054.lan.mdns > 224.0.0.251.mdns: 0* [0q] 10/0/0 PTR _shelly._tcp.local., PTR _http._tcp.local., PTR shellyplusplugs-80646fd63054._shelly._tcp.local., (Cache flush) SRV ShellyPlusPlugS-80646FD63054.local.:80 0 0, (Cache flush) TXT "app=PlusPlugS" "ver=0.14.4" "gen=2", PTR ShellyPlusPlugS-80646FD63054._http._tcp.local., (Cache flush) SRV ShellyPlusPlugS-80646FD63054.local.:80 0 0, (Cache flush) TXT "gen=2", (Cache flush) A 192.168.1.245, (Cache flush) NSEC (772)
```

**Comment by Apollon77** [comment]
@itsopti If you say then good, I do not know linux internals enough to judge it :-) In fact matter.js opens an UDP socket on the host to get MDNS messages and send them out ...

**Comment by itsopti** [comment]
@scargill it is "-i any" which means that packets for ANY interface will be tracked. You could use "-i eth0" to just capture eth0 but you would need to check if your interface really is named eth0. Mine is named ens160 so -i any is the easy way around.
The second paramter is "port 5353" so only packets on port 5353 are beeing tracked. 5353 is mdns.
Make sure to use both parameters with tcpdump.
Before installing avahi or activating mdns this should be pretty much empty. Only the announcement packages from matter.js should be showing. 

Afterwards it should capture a ton of packages

**Comment by scargill** [comment]
> 

A short selection of what comes in...

```
pi@mainpi:.node-red:14:30[0]> sudo tcpdump -i eth0 port 5353

tcpdump: verbose output suppressed, use -v or -vv for full protocol decode
listening on eth0, link-type EN10MB (Ethernet), capture size 262144 bytes
14:30:43.886476 IP 192.168.1.149.mdns > 224.0.0.251.mdns: 0*- [0q] 4/0/0 PTR _ewelink._tcp.local., PTR eWeLink_1001720e47._ewelink._tcp.local., (Cache flush) SRV eWeLink_1001720e47.local.:8081 0 0, (Cache flush) TXT "data3=dhZ8L2hOBcwsljO0gl" "data2=IgP7XEmYY/xaL8syvdoQkzkhF61T/P3ovBQxjSZkH3wQWLlrX8Kc8uMfqAm48eMv+OkooeVNEv4QPKSfTWbN6zSGZGec1+PoG2QXRJPfVF14QoVEnA4uNu3qGqzDbeMtx7mq5cVKgbKXTABqvcVwWSUg1PBjoqHCz6s9fgvtUu7y6S0pBY0fJSqVuQwuSOUZ+eAT+ykw6ejwjm1XEy0LPC5+gJHugPNiXmTkcolTIvMMe5mn6dU8cBn" "data1=pkdzgehImw5Im5c6nH3M9YmL7a3M491dyblptKxG/KxnvUN5c1loI5NrSbVDtOTD2TV3q+HnhUWb/xYIrjoULpOat+6UOHXVO81UJw+Jh58bvinpnekahOcL/3ILPDtKLoLOkqd7V+5UxsOkJWqKqNQZLG9WtMI32zkN9NZ15tLU5VwVwTmDhM0x6X5iHP81kINL/xlIAzAs61963Pj7a9lLRMqiIMcXLemVR1Kjqg7V4ejJy04j1HT" "seq=105669" "iv=ODQyOTIxMzUzNzkwNzcyMQ==" "encrypt=true" "apivers=1" "type=th_plug" "id=1001720e47" "txtvers=1" (869)
14:30:43.987819 IP6 fe80::bad6:1aff:fea6:a364.mdns > ff02::fb.mdns: 0*- [0q] 4/0/0 PTR _ewelink._tcp.local., PTR eWeLink_1001720e47._ewelink._tcp.local., (Cache flush) SRV eWeLink_1001720e47.local.:8081 0 0, (Cache flush) TXT "data3=dhZ8L2hOBcwsljO0gl" "data2=IgP7XEmYY/xaL8syvdoQkzkhF61T/P3ovBQxjSZkH3wQWLlrX8Kc8uMfqAm48eMv+OkooeVNEv4QPKSfTWbN6zSGZGec1+PoG2QXRJPfVF14QoVEnA4uNu3qGqzDbeMtx7mq5cVKgbKXTABqvcVwWSUg1PBjoqHCz6s9fgvtUu7y6S0pBY0fJSqVuQwuSOUZ+eAT+ykw6ejwjm1XEy0LPC5+gJHugPNiXmTkcolTIvMMe5mn6dU8cBn" "data1=pkdzgehImw5Im5c6nH3M9YmL7a3M491dyblptKxG/KxnvUN5c1loI5NrSbVDtOTD2TV3q+HnhUWb/xYIrjoULpOat+6UOHXVO81UJw+Jh58bvinpnekahOcL/3ILPDtKLoLOkqd7V+5UxsOkJWqKqNQZLG9WtMI32zkN9NZ15tLU5VwVwTmDhM0x6X5iHP81kINL/xlIAzAs61963Pj7a9lLRMqiIMcXLemVR1Kjqg7V4ejJy04j1HT" "seq=105669" "iv=ODQyOTIxMzUzNzkwNzcyMQ==" "encrypt=true" "apivers=1" "type=th_plug" "id=1001720e47" "txtvers=1" (846)
14:30:44.085668 IP 192.168.1.149.mdns > 224.0.0.251.mdns: 0*- [0q] 4/0/0 PTR _ewelink._tcp.local., PTR eWeLink_1001720e47._ewelink._tcp.local., (Cache flush) SRV eWeLink_1001720e47.local.:8081 0 0, (Cache flush) TXT "data3=dhZ8L2hOBcwsljO0gl" "data2=IgP7XEmYY/xaL8syvdoQkzkhF61T/P3ovBQxjSZkH3wQWLlrX8Kc8uMfqAm48eMv+OkooeVNEv4QPKSfTWbN6zSGZGec1+PoG2QXRJPfVF14QoVEnA4uNu3qGqzDbeMtx7mq5cVKgbKXTABqvcVwWSUg1PBjoqHCz6s9fgvtUu7y6S0pBY0fJSqVuQwuSOUZ+eAT+ykw6ejwjm1XEy0LPC5+gJHugPNiXmTkcolTIvMMe5mn6dU8cBn" "data1=pkdzgehImw5Im5c6nH3M9YmL7a3M491dyblptKxG/KxnvUN5c1loI5NrSbVDtOTD2TV3q+HnhUWb/xYIrjoULpOat+6UOHXVO81UJw+Jh58bvinpnekahOcL/3ILPDtKLoLOkqd7V+5UxsOkJWqKqNQZLG9WtMI32zkN9NZ15tLU5VwVwTmDhM0x6X5iHP81kINL/xlIAzAs61963Pj7a9lLRMqiIMcXLemVR1Kjqg7V4ejJy04j1HT" "seq=105669" "iv=ODQyOTIxMzUzNzkwNzcyMQ==" "encrypt=true" "apivers=1" "type=th_plug" "id=1001720e47" "txtvers=1" (846)
14:30:44.189297 IP6 fe80::bad6:1aff:fea6:a364.mdns > ff02::fb.mdns: 0*- [0q] 4/0/0 PTR _ewelink._tcp.local., PTR eWeLink_1001720e47._ewelink._tcp.local., (Cache flush) SRV eWeLink_1001720e47.local.:8081 0 0, (Cache flush) TXT "data3=dhZ8L2hOBcwsljO0gl" "data2=IgP7XEmYY/xaL8syvdoQkzkhF61T/P3ovBQxjSZkH3wQWLlrX8Kc8uMfqAm48eMv+OkooeVNEv4QPKSfTWbN6zSGZGec1+PoG2QXRJPfVF14QoVEnA4uNu3qGqzDbeMtx7mq5cVKgbKXTABqvcVwWSUg1PBjoqHCz6s9fgvtUu7y6S0pBY0fJSqVuQwuSOUZ+eAT+ykw6ejwjm1XEy0LPC5+gJHugPNiXmTkcolTIvMMe5mn6dU8cBn" "data1=pkdzgehImw5Im5c6nH3M9YmL7a3M491dyblptKxG/KxnvUN5c1loI5NrSbVDtOTD2TV3q+HnhUWb/xYIrjoULpOat+6UOHXVO81UJw+Jh58bvinpnekahOcL/3ILPDtKLoLOkqd7V+5UxsOkJWqKqNQZLG9WtMI32zkN9NZ15tLU5VwVwTmDhM0x6X5iHP81kINL/xlIAzAs61963Pj7a9lLRMqiIMcXLemVR1Kjqg7V4ejJy04j1HT" "seq=105669" "iv=ODQyOTIxMzUzNzkwNzcyMQ==" "encrypt=true" "apivers=1" "type=th_plug" "id=1001720e47" "txtvers=1" (846)
14:30:44.285921 IP 192.168.1.149.mdns > 224.0.0.251.mdns: 0*- [0q] 4/0/0 PTR _ewelink._tcp.local., PTR eWeLink_1001720e47._ewelink._tcp.local., (Cache flush) SRV eWeLink_1001720e47.local.:8081 0 0, (Cache flush) TXT "data3=dhZ8L2hOBcwsljO0gl" "data2=IgP7XEmYY/xaL8syvdoQkzkhF61T/P3ovBQxjSZkH3wQWLlrX8Kc8uMfqAm48eMv+OkooeVNEv4QPKSfTWbN6zSGZGec1+PoG2QXRJPfVF14QoVEnA4uNu3qGqzDbeMtx7mq5cVKgbKXTABqvcVwWSUg1PBjoqHCz6s9fgvtUu7y6S0pBY0fJSqVuQwuSOUZ+eAT+ykw6ejwjm1XEy0LPC5+gJHugPNiXmTkcolTIvMMe5mn6dU8cBn" "data1=pkdzgehImw5Im5c6nH3M9YmL7a3M491dyblptKxG/KxnvUN5c1loI5NrSbVDtOTD2TV3q+HnhUWb/xYIrjoULpOat+6UOHXVO81UJw+Jh58bvinpnekahOcL/3ILPDtKLoLOkqd7V+5UxsOkJWqKqNQZLG9WtMI32zkN9NZ15tLU5VwVwTmDhM0x6X5iHP81kINL/xlIAzAs61963Pj7a9lLRMqiIMcXLemVR1Kjqg7V4ejJy04j1HT" "seq=105669" "iv=ODQyOTIxMzUzNzkwNzcyMQ==" "encrypt=true" "apivers=1" "type=th_plug" "id=1001720e47" "txtvers=1" (846)
14:30:44.394625 IP6 fe80::bad6:1aff:fea6:a364.mdns > ff02::fb.mdns: 0*- [0q] 4/0/0 PTR _ewelink._tcp.local., PTR eWeLink_1001720e47._ewelink._tcp.local., (Cache flush) SRV eWeLink_1001720e47.local.:8081 0 0, (Cache flush) TXT "data3=dhZ8L2hOBcwsljO0gl" "data2=IgP7XEmYY/xaL8syvdoQkzkhF61T/P3ovBQxjSZkH3wQWLlrX8Kc8uMfqAm48eMv+OkooeVNEv4QPKSfTWbN6zSGZGec1+PoG2QXRJPfVF14QoVEnA4uNu3qGqzDbeMtx7mq5cVKgbKXTABqvcVwWSUg1PBjoqHCz6s9fgvtUu7y6S0pBY0fJSqVuQwuSOUZ+eAT+ykw6ejwjm1XEy0LPC5+gJHugPNiXmTkcolTIvMMe5mn6dU8cBn" "data1=pkdzgehImw5Im5c6nH3M9YmL7a3M491dyblptKxG/KxnvUN5c1loI5NrSbVDtOTD2TV3q+HnhUWb/xYIrjoULpOat+6UOHXVO81UJw+Jh58bvinpnekahOcL/3ILPDtKLoLOkqd7V+5UxsOkJWqKqNQZLG9WtMI32zkN9NZ15tLU5VwVwTmDhM0x6X5iHP81kINL/xlIAzAs61963Pj7a9lLRMqiIMcXLemVR1Kjqg7V4ejJy04j1HT" "seq=105669" "iv=ODQyOTIxMzUzNzkwNzcyMQ==" "encrypt=true" "apivers=1" "type=th_plug" "id=1001720e47" "txtvers=1" (846)

```

**Comment by scargill** [comment]
Hi - ok set to TRACE

I've tried to remove anything obviously NOT to do with this - as best I can,,, down near the bottom is some stuff about matter.... even then there was too much info so I put it in an included text file...

```

[matterlog.txt](https://github.com/FezVrasta/node-red-matter/files/12565778/matterlog.txt)
